{
  "schema_version": "0.1",
  "feed_version": "2026-06-04",
  "run_diff_scope": "latest_generator_run",
  "durable_history": false,
  "removed_semantics": "missing_from_current_generator_state_not_official_deletion",
  "generated_at": "2026-06-05T12:38:50+09:00",
  "previous_generated_at": "2026-06-05T12:25:11+09:00",
  "added_count": 0,
  "updated_count": 0,
  "removed_count": 0,
  "added": [],
  "updated": [],
  "removed": []
}
